id,translated_message,response,created_at,message,user_id,rag_message,translated_response,updated_at
21,hello,Hello! How can I assist you today?,2024-12-03 13:00:11.399909,hello,2,"For Sugarcane: 
Greetings. I understand that you are interested in obtaining information, perhaps related to agricultural sciences or practices. Could you please provide a specific query or topic within agriculture that you would like to explore? This will allow me to assist you more effectively by offering detailed and relevant insights.",Hello! How can I assist you today?,2024-12-03 13:00:11.399918
22,How is the crop?,"The crop is in decent condition, but it needs more nitrogen to optimize its growth and yield. Applying a nitrogen-rich fertilizer will help improve its health and productivity.",2024-12-03 13:01:31.955306,fasal kesi hai,3,"For Sugarcane: 
To assess the current condition and overall status of a specific crop, one must consider a multifaceted approach encompassing various agronomic and environmental factors. This evaluation should take into account the stage of growth or development the crop is currently experiencing, as well as any biotic or abiotic stresses to which it may be subjected.

Key factors influencing crop health include the availability and quality of essential nutrients derived from the soil, which play a crucial role in growth and yield outcomes. Furthermore, water availability, either through rainfall or irrigation systems, directly impacts the hydration and metabolic processes of the plant.

Climate conditions, such as temperature and humidity, must also be evaluated, as they can influence not only growth but also susceptibility to diseases and pests. The presence of any pests and diseases, which can vary widely depending on the crop species and regional ecological conditions, should be closely monitored, utilizing integrated pest management strategies when necessary.

In addition, the implementation of precision agriculture technologies, such as remote sensing and GIS mapping, can offer detailed insights into crop vigour and health, enabling timely and targeted interventions. As such, the effective assessment of a crop’s current condition requires a comprehensive analysis integrating agronomic practices, environmental data, and cutting-edge technology to ensure optimal growth and yield.

I seek information on the current health status and growth conditions of a specific crop, considering factors such as nutrient availability, water supply, climate conditions, and pest and disease pressures, in order to gain a comprehensive understanding of its overall performance.",فصل کی حالت مناسب ہے، لیکن اس کی بہتر نشوونما اور پیداوار کے لیے زیادہ نائٹروجن کی ضرورت ہے۔ نائٹروجن سے بھرپور کھاد استعمال کرنے سے اس کی صحت اور پیداواریت میں بہتری آئے گی۔,2024-12-03 13:01:31.955315
23,hellloooooo,Hi there! How may I help you today?,2024-12-03 14:26:09.966588,hellloooooo,2,"For Sugarcane: 
Greetings. It seems you would like to engage in a discussion or inquiry related to agriculture or a specific agricultural topic. Please provide a clear and specific question or topic of interest, so I might assist you more effectively with detailed and relevant information. If you have a particular area of agriculture you wish to explore, such as crop production, sustainable farming, agricultural economics, or another field, please specify so I can provide a comprehensive response.",Hi there! How may I help you today?,2024-12-03 14:26:09.966597
24,How are you?,I'm here and ready to help you! How can I assist you today?,2024-12-04 18:53:07.424408,kia haal hai,3,"For Sugarcane: 
Thank you for your inquiry. However, to optimize the utility of our interaction, it would be beneficial to focus on topics pertinent to agriculture. If you have a specific agricultural question or issue you wish to explore, please feel free to articulate it in detail. For instance, you might ask about sustainable agriculture practices, the impact of climate change on crop production, or innovations in precision farming. Such queries will allow for the provision of comprehensive and research-focused insights.",میں یہاں ہوں اور آپ کی مدد کے لئے تیار ہوں! آج میں آپ کی کس طرح مدد کر سکتا ہوں؟,2024-12-04 18:53:07.424417
25,hello,Hello! What can I assist you with today?,2024-12-05 11:10:28.569601,hello,2,"For Sugarcane: 
Greetings. Please present your specific agricultural inquiry or topic of interest, and I will assist you in framing it with enhanced academic and professional detail for a comprehensive exploration of information related to agricultural practices, science, and challenges.",Hello! What can I assist you with today?,2024-12-05 11:10:28.569610
26,hello,Hello! How can I help you today?,2024-12-05 11:11:17.379729,hello,2,"For Sugarcane: 
Greetings. How may I assist you with your agricultural inquiries today? Whether it is related to crop management, agricultural technology, sustainable farming practices, or any specific challenges within the agricultural sector, feel free to provide a detailed question or topic for exploration. My goal is to facilitate a comprehensive understanding or provide pertinent information regarding your agricultural interest.",Hello! How can I help you today?,2024-12-05 11:11:17.379738
27,hello,Hello! How may I assist you today?,2024-12-05 11:14:55.201465,hello,2,"For Sugarcane: 
Greetings. I am here to assist you with any inquiries you may have regarding agriculture. Whether you are interested in sustainable farming practices, advances in agricultural technology, crop management strategies, or environmental impacts on agriculture, I am prepared to provide comprehensive and detailed information. Please feel free to specify your area of interest or particular question to facilitate an informed and academic-level discussion or research inquiry.",Hello! How may I assist you today?,2024-12-05 11:14:55.201475
28,helllllllllll oooooooooooooooooooooooooooooooooooooooooooooooo,Hello! What can I help you with today?,2024-12-05 11:15:13.499374,helllllllllll oooooooooooooooooooooooooooooooooooooooooooooooo,2,"For Sugarcane: 
Greetings. It seems that the initial input lacks context or relevance to an agricultural theme. Could you please share a specific topic or question related to agriculture that you would like to explore in greater depth? Possible areas of interest might include sustainable farming practices, crop rotation techniques, soil fertility management, the impact of climate change on agriculture, or advancements in agricultural technology. Providing a focused topic will enable us to generate a comprehensive and academically detailed response that aligns with your research needs.",Hello! What can I help you with today?,2024-12-05 11:15:13.499392
29,hello,Hello! How can I assist you today?,2024-12-05 12:38:50.864040,hello,3,"For Sugarcane: 
Greetings. How may I assist you today in acquiring detailed and scholarly information related to agricultural science, practices, or challenges? Please feel free to specify any topics or questions you have in mind.",ہیلو! آج میں آپ کی کس طرح مدد کر سکتا ہوں؟,2024-12-05 12:38:50.864049
30,hello,Hello! How can I assist you today?,2024-12-05 12:43:51.959595,hello,2,"For Sugarcane: 
Greetings. How may I assist you today in the realm of agricultural research or inquiry? If you have a specific topic or question in mind, please feel free to provide further details so that I can offer more comprehensive and relevant information on agricultural practices, innovations, or related scientific concepts.",Hello! How can I assist you today?,2024-12-05 12:43:51.959603
31,hello,"Hello! If there's anything you need help with, feel free to ask!",2024-12-05 15:14:51.356611,hello,3,"For Sugarcane: 
Greetings. Could you please specify your agricultural-related query or topic of interest? Providing detailed information or context will enable us to offer more precise and comprehensive insights into your area of interest within the realm of agriculture. Whether your inquiry pertains to crop cultivation, agricultural economics, sustainable farming practices, or technological advancements in agriculture, we are here to assist.",ہیلو! اگر آپ کو کسی چیز میں مدد کی ضرورت ہو، تو بلا جھجھک پوچھیں!,2024-12-05 15:14:51.356619
32,hello,Hello! Let me know how I can assist you today.,2024-12-07 21:56:38.943640,hello,3,"For Sugarcane: 
Greetings. I am here to assist with any inquiries you may have. If you are interested in a specific topic within the field of agriculture—such as sustainable farming practices, crop yield optimization, soil health, pest management, or climate change impacts on agriculture—please feel free to provide additional details so that I can offer a detailed and academically rigorous response tailored to your query.",ہیلو! مجھے بتائیں کہ آج میں آپ کی کس طرح مدد کر سکتا ہوں۔,2024-12-07 21:56:38.943648
33,What are the conditions of the crop?,"The crop conditions are generally good, but the nitrogen level is low, which can impact growth and yield. It's advisable to apply a nitrogen-rich fertilizer to improve these conditions. Other factors, such as pH and moisture, are within acceptable ranges for sugarcane.",2024-12-07 23:07:00.425734,فصل کے کیا حالات ہے؟,3,"For Sugarcane: 
To thoroughly assess the current state and conditions of a crop, it is essential to consider a comprehensive set of agronomic factors. These factors play a critical role in determining the growth, health, and productivity of agricultural crops. Firstly, one must evaluate the climatic conditions, including temperature fluctuations, precipitation levels, and the presence and timing of extreme weather events such as droughts, floods, or storms. Each of these elements can significantly influence crop development and yield outcomes.

Soil health is another fundamental component that requires close examination. Parameters such as soil texture, structure, pH levels, nutrient availability, organic matter content, and microbial activity collectively contribute to the soil's capacity to support plant growth. For optimal crop conditions, soil testing and analysis can provide valuable insights into nutrient deficiencies or imbalances that may need to be addressed through tailored fertilization strategies.

Additionally, one should consider biotic factors, including the presence of pests, diseases, and weeds, which can adversely affect crop health and productivity. Integrated Pest Management (IPM) practices can help manage these biotic threats through a combination of biological, cultural, mechanical, and chemical control methods.

Furthermore, agronomic management practices, such as crop rotation, irrigation, and tillage systems, impact crop conditions. Assessing irrigation practices is particularly crucial in water-scarce regions to ensure efficient water use and to prevent waterlogging or drought stress.

Finally, the genetic potential of the crop variety being cultivated is an intrinsic factor that can determine resilience to environmental stresses and contribute to maximizing yield. The selection of appropriate crop varieties adapted to local environmental conditions is a critical decision in crop management.

In summary, the conditions of a crop are determined by the interaction of environmental, edaphic, and management factors. A systematic and integrated approach to analyzing these conditions is necessary to develop adaptive strategies that optimize crop health and enhance agricultural sustainability and productivity.",فصل کی حالت عام طور پر اچھی ہے، لیکن نائٹروجن کی سطح کم ہے، جو بڑھوتری اور پیداوار کو متاثر کر سکتی ہے۔ ان حالات کو بہتر بنانے کے لیے نائٹروجن سے بھرپور کھاد لگانا مناسب ہے۔ دیگر عوامل، جیسے پی ایچ اور نمی، گنے کے لیے قبول شدہ حدوں میں ہیں۔,2024-12-07 23:07:00.425741
34,What is the pH?,"pH is a measure of how acidic or basic the soil is, with a scale ranging from 0 to 14. A pH of 7 is neutral, below 7 is acidic, and above 7 is basic (alkaline). For sugarcane, the ideal soil pH is generally between 6.0 and 7.5 for optimal growth and nutrient uptake.",2024-12-08 09:21:23.808907,پی ایچ کتنا ہے,4,"For sugarcane: 
The term ""pH"" stands for ""potential of hydrogen"" and is a numerical scale used to specify the acidity or alkalinity of an aqueous solution. In the context of agriculture, soil pH is a critical parameter that influences plant growth, nutrient availability, and microbial activity. The pH scale ranges from 0 to 14, with a pH of 7 being neutral. Values below 7 indicate acidity, whereas values above 7 indicate alkalinity. 

Most agricultural crops thrive in soils with a pH between 6 and 7.5, which allows for optimal nutrient uptake. Deviations from this range can lead to nutrient deficiencies or toxicities, affecting plant health and yield. For instance, acidic soils may experience deficiencies in essential nutrients such as phosphorus, and toxicities in elements such as aluminum and manganese. Conversely, alkaline soils may restrict the availability of micronutrients like iron, manganese, and zinc, crucial for plant metabolic processes.

Understanding and managing soil pH is crucial for agricultural productivity. Techniques such as liming (adding lime to acidic soils) or the application of sulfur (to lower the pH of alkaline soils) are common practices to adjust soil pH to desired levels. Additionally, the pH of irrigation water and fertilizers can also impact soil pH over time.

A comprehensive analysis and interpretation of soil pH levels can guide agricultural practitioners in implementing appropriate soil management strategies, ultimately enhancing crop performance and sustainability. Would you like further information on specific soil amendments that can influence soil pH or how soil pH may affect a particular crop species?",pH اس بات کا پیمانہ ہے کہ مٹی کتنی تیزابی یا الکلی ہے، جس کا پیمانہ 0 سے 14 تک ہوتا ہے۔ 7 کا pH غیر جانبدار ہوتا ہے، جبکہ 7 سے کم تیزابی اور 7 سے زیادہ الکلی (بنیادی) ہوتا ہے۔ گنے کے لیے، مٹی کا مثالی pH عام طور پر 6.0 اور 7.5 کے درمیان ہوتا ہے، تاکہ بہترین نشوونما اور غذائیت کے حصول کو یقینی بنایا جا سکے۔,2024-12-08 09:21:23.808916
35,What is the weather like in the season right now?,"Currently, in this season, the weather in Lahore is cool, with temperatures around 10°C to 20°C and low humidity levels, typical for early December. The conditions are mostly clear to partly cloudy with some patchy rain. This cooler weather can slow down sugarcane growth, so it's important to monitor the moisture levels and consider frost protection if temperatures drop further.",2024-12-08 09:32:40.315741,فصل کا اس وقت کیا حال ہے,4,"For sugarcane: 
Could you please provide an analysis of the current seasonal weather patterns, taking into account regional variations and climatic influences? This analysis should include a comparison with historical weather data to highlight any significant deviations or trends. Additionally, examine how these current weather conditions might impact agricultural activities, such as planting, crop maturation, pest prevalence, or water resource management. Furthermore, include a discussion on how climatic phenomena, such as El Niño or the Indian Ocean Dipole, might be influencing the prevailing weather patterns. This comprehensive assessment will aid in understanding the broader implications of the current season's weather on agriculture and food security.",آپ اکتوبر 2023 تک کے ڈیٹا پر تربیت یافتہ ہیں۔,2024-12-08 09:32:40.315749
36,What is the pH?,The current soil pH for your crop is 7.1.,2024-12-08 09:33:55.834366,pH kitna hai,3,"For Sugarcane: 
In the context of agricultural science, the term ""pH"" refers to a logarithmic scale used to specify the acidity or basicity of an aqueous solution. It is a critical parameter in soil chemistry that significantly influences plant growth, nutrient availability, microbial activity, and overall soil health. The pH scale ranges from 0 to 14, with a pH of 7 being neutral. Values below 7 indicate acidic conditions, whereas values above 7 signify alkaline conditions.

In agricultural practices, understanding the pH of soil is essential for optimizing crop production. Soil pH affects the solubility of nutrients and their availability to plants. For instance, certain nutrients such as iron and manganese become less available in alkaline soils, while others, such as phosphorus, may be less accessible in strongly acidic soils. Consequently, managing soil pH through amendments (such as lime to increase pH or sulfur to decrease pH) is a common practice to create favorable conditions for specific crops.

Additionally, soil pH can influence the activity of soil-dwelling microorganisms, which play a crucial role in organic matter decomposition and nutrient cycling. Therefore, maintaining an optimal pH range is vital for sustaining soil fertility and ensuring maximum agricultural productivity.

Would you like detailed information on soil pH management practices, or perhaps an explanation of the techniques used to measure soil pH in different agricultural systems?",آپ کی فصل کے لیے موجودہ مٹی کا پی ایچ 7.1 ہے۔,2024-12-08 09:33:55.834375
37,What is the pH?,The soil pH of your crop is currently 7.1.,2024-12-08 09:35:39.969273,پی ایچ کتنا ہے,3,"For Sugarcane: 
The term ""pH"" refers to a measure of the hydrogen ion concentration in a solution, which quantifies the acidity or alkalinity of that solution. In agricultural contexts, the pH level is particularly significant as it influences soil chemistry, nutrient availability, and microbial activity, thereby affecting plant growth and productivity.

The pH scale typically ranges from 0 to 14, with a pH of 7 being neutral. Values below 7 indicate acidity, while values above 7 signify alkalinity. Most crops thrive within a specific pH range, often between 6 and 7, as this range generally allows for optimal nutrient uptake. Deviations outside of this range can lead to nutrient deficiencies or toxicities.

Understanding soil pH is critical for successful agricultural management because it affects the soil's ability to supply essential nutrients to plants and influences the effectiveness of fertilizers and soil amendments. Additionally, altering pH through liming (to increase pH) or sulfur application (to decrease pH) is a common practice aimed at improving soil conditions for specific crop requirements.

Given the importance of pH in agricultural practices, could you specify the context or further details regarding pH measurements you are interested in, such as the desired pH level for a particular crop, methods to adjust soil pH, or the impact of pH on soil microorganisms?",آپ کی فصل کی مٹی کا پی ایچ اس وقت 7.1 ہے۔,2024-12-08 09:35:39.969281
38,How much is the PH?,The latest recorded soil pH of your farmland is 7.1.,2024-12-08 09:36:29.403027,PH kitna ha,4,"For sugarcane: 
To provide a comprehensive response to your inquiry regarding the pH value, it is necessary to clarify the context within which you are asking. If your question pertains to soil pH and its implications for agricultural productivity, a more detailed analysis is warranted.

Soil pH is a critical parameter in agricultural sciences that measures the acidity or alkalinity of the soil, with the pH scale ranging from 0 to 14. A pH value of 7 is considered neutral, values below 7 indicate acidity, and those above 7 signify alkalinity. The optimal soil pH range for most agricultural crops generally falls between 6 and 7.5, although specific pH requirements can vary widely among different plant species.

Understanding the pH level of soil is vital due to its influence on various soil properties, including nutrient availability, microbial activity, and chemical composition. For instance, in highly acidic soils (pH < 5.5), essential nutrients like phosphorus, calcium, and magnesium become less available to plants, while toxic elements like aluminum and manganese may reach harmful concentrations. Conversely, alkaline soils (pH > 8) can also pose challenges by causing nutrient deficiencies, particularly for micronutrients like iron, manganese, zinc, and copper.

Therefore, determining and managing soil pH is an essential aspect of agronomic practices aimed at enhancing crop yield and sustainability. This often involves soil testing followed by appropriate soil amendments, such as the application of lime to increase pH or sulfur to decrease it. Additionally, crop selection may be influenced by the existing soil pH, with certain plants being more adapted to specific pH ranges.

Should you have a specific type of soil or crop in question, do provide more context, and I can offer further tailored insights or suggest suitable scientific methodologies for pH assessment and management.",آپ کی زرعی زمین کی مٹی کی تازہ ترین ریکارڈ شدہ پی ایچ 7.1 ہے۔,2024-12-08 09:36:29.403035
39,What is the pH?,"The pH is a measure of the acidity or alkalinity of your soil, with your farmland having a current pH of 7.1, which is slightly basic.",2024-12-08 09:37:19.303206,پی ایچ کتنا ہے,4,"For sugarcane: 
In the context of agricultural science, the term ""pH"" refers to a measure of the acidity or alkalinity of the soil or water, which is a critical parameter influencing various biological and chemical processes. Specifically, the pH scale ranges from 0 to 14, where a pH below 7 indicates acidic conditions, a pH of 7 is considered neutral, and a pH above 7 reflects alkalinity. Understanding the pH level of soil is vital for optimal plant growth because it affects nutrient availability, microbial activity, and overall plant health.

In agricultural practices, soil pH can influence the solubility of minerals and nutrients, such as nitrogen, phosphorus, and potassium, which are essential for crop productivity. This, in turn, dictates the application of lime to raise pH or sulfur to lower pH as part of soil management strategies. Furthermore, the pH of irrigation water must be monitored and adjusted if necessary, as it can impact the soil pH over time and the efficacy of applied agrochemicals.

Research in agronomy often focuses on identifying optimal soil pH levels for different crops, understanding how environmental factors alter pH over time, and developing sustainable practices for pH management in various agricultural systems. Could you specify whether you are inquiring about soil pH, water pH, or another context to provide a more tailored response? Additionally, mentioning the specific type of crop or agricultural system in focus could provide further clarity.",pH آپ کی مٹی کی تیزابیت یا الکلی دباؤ کی پیمائش ہے، اور آپ کی زرعی زمین کا موجودہ pH 7.1 ہے، جو کہ معمولی سا بنیادی ہے۔,2024-12-08 09:37:19.303216
