id,translated_message,response,created_at,message,user_id,rag_message,translated_response,updated_at
1,Is the crop correct?,"Your sugarcane crop is mostly doing well, but it does need an increase in nitrogen levels to optimize growth. Addressing this nutrient deficiency will improve the overall health and yield of the crop. Other factors like pH and moisture levels are appropriate for sugarcane.",2024-11-30 21:10:16.887910,fasal sahi hai?,3,"For Sugarcane: 
To comprehensively assess whether the crop selected is appropriate for cultivation in a particular agricultural setting, several factors and parameters must be considered. Please provide details regarding the specific crop species in question as well as the environmental conditions and agricultural practices in place. 

1. **Climatic Suitability**: Does the crop align with the regional climate, including temperature ranges, precipitation patterns, and seasonal variations? It's essential to evaluate whether the climatic conditions support the growth and productivity of the crop throughout its life cycle.

2. **Soil Characteristics**: Are the soil properties, such as pH, texture, structure, and nutrient availability, conducive to the selected crop? Understanding the soil's ability to hold nutrients and water, as well as its drainage capacity, is critical for plant health and yield.

3. **Water Resources and Irrigation**: What is the availability and reliability of water resources for the crop? Consideration of local water supply, irrigation infrastructure, and efficiency is imperative, particularly if the crop has high water demands.

4. **Market Demand and Economic Viability**: Is there a robust market demanda for the crop, and what are the potential economic returns? Market analysis, including local, regional, and global trends, can guide decisions about crop selection.

5. **Pest and Disease Pressure**: Can the crop withstand local pest and disease challenges? Resistance or susceptibility to biotic stresses must be evaluated to anticipate potential impacts on yield and quality.

6. **Sustainability Practices**: Will the crop contribute to or detract from sustainable agricultural practices? Consideration should be given to factors such as crop rotation, biodiversity, and ecological impact.

7. **Regulatory and Policy Considerations**: Are there any local or national regulations, such as environmental or land-use policies, that might affect the cultivation of this crop?

By providing additional context and specifics regarding these aspects, a more detailed analysis can be conducted to determine if the crop is indeed correct for the intended agricultural scenario.",آپ کا گنا کی فصل زیادہ تر اچھی جا رہی ہے، لیکن اس کی نشوونما کو بہتر بنانے کے لئے نائٹروجن کی سطح میں اضافہ کی ضرورت ہے۔ اس غذائی قلت کو دور کرنے سے فصل کی مجموعی صحت اور پیداوار میں بہتری آئے گی۔ دیگر عوامل جیسے پی ایچ کی سطح اور نمی کی سطح گنا کے لئے مناسب ہیں۔,2024-11-30 21:10:16.887917
2,Is the crop okay?,"The crop is generally okay, but it requires additional nitrogen for optimal growth. Ensuring the soil has adequate nitrogen will boost plant health and productivity. Other conditions, like pH and moisture, are suitable.",2024-11-30 21:10:32.940844,fasal sahi hai?,3,"For Sugarcane: 
To accurately assess the current status of a specific crop, it is essential to consider various agronomic and environmental factors that could impact its health and productivity. Consequently, I am seeking a comprehensive evaluation of the crop's condition, taking into account the prevalent weather patterns, soil fertility levels, pest and disease pressures, and recent agricultural practices implemented in the area.

Could you provide an overview of the crop's phenological stage and any specific indicators of stress or abnormal growth? Additionally, information related to recent climatic conditions, such as precipitation, temperature variations, and any extreme weather events, would provide valuable insights into potential environmental stressors.

Furthermore, insights into the recent management practices employed, such as irrigation, fertilization, pest control measures, and any known biotic or abiotic challenges the crop has faced, would contribute to a more thorough understanding of its current state.

By compiling and analyzing this data, it is possible to determine the overall health and viability of the crop and identify any necessary agronomic interventions to optimize its growth and yield.",فصل عمومی طور پر ٹھیک ہے، لیکن بہتر نمو کے لیے اضافی نائٹروجن کی ضرورت ہے۔ مٹی میں مناسب نائٹروجن کی موجودگی کو یقینی بنانے سے پودوں کی صحت اور پیداوار میں اضافہ ہوگا۔ دیگر حالات جیسے پی ایچ اور نمی موزوں ہیں۔,2024-11-30 21:10:32.940854
3,Is the crop okay?,"Yes, the crop is okay overall, but it does need more nitrogen for better growth. Balancing the nitrogen levels will help improve its health and yield.",2024-11-30 21:11:10.767935,fasal sahi hai?,3,"For Sugarcane: 
To accurately assess the status and health of an agricultural crop, a comprehensive evaluation encompassing various agronomic and environmental factors is essential. Specifically, one must consider the crop's growth stage, potential signs of biotic stress from pests or diseases, and abiotic stressors such as drought, excessive moisture, or nutrient deficiencies. Additionally, it is pertinent to analyze recent weather conditions, soil health parameters including pH, organic matter content, and nutrient availability, as well as any recent agricultural practices such as fertilization or pesticide application. Monitoring these variables through methods such as field scouting, soil testing, and remote sensing technologies can provide insights into the current condition of the crop. Furthermore, historical crop performance and ongoing management practices should be reviewed to make informed decisions regarding the crop's potential yield and overall vitality. How does the integration of these multidisciplinary aspects collectively inform the overall assessment of crop health and productivity in this particular context?",آپ نے اکتوبر 2023 تک کے ڈیٹا پر تربیت حاصل کی ہے۔,2024-11-30 21:11:10.767941
4,Is the crop okay?,"The crop is mostly fine, but the low nitrogen levels need attention. Adding nitrogen fertilizer will help improve growth and yield.",2024-11-30 21:17:42.368816,fasal sahi hai?,3,"For Sugarcane: 
To accurately assess the current condition of a specific crop, several factors need to be considered, which encompass a range of biotic and abiotic elements impacting plant health and productivity. Could you provide more context regarding the crop species in question, as well as its current geographic region and environmental conditions?

Key factors influencing crop health include:

1. **Soil Quality:** Understanding the composition, pH, and nutrient content of the soil is essential for assessing whether it provides adequate support for crop growth.
   
2. **Weather Conditions:** Examine recent and predicted weather patterns, including temperature extremes, precipitation levels, and occurrences of extreme weather events, as these greatly affect crop health.

3. **Pest and Disease Pressure:** Consider any observable signs of pest infestations or plant diseases, which can drastically reduce yield and quality.

4. **Water Availability and Irrigation Practices:** Determine the adequacy of water supply through rainfall or irrigation systems, as both drought and waterlogging can be detrimental to crops.

5. **Agricultural Management Practices:** Include crop rotation history, fertilizer application rates, and other agronomic practices that might influence current crop status.

Please provide additional details on these aspects so a more precise evaluation of the crop's condition can be formulated, considering both current observations and historical data.",فصل زیادہ تر ٹھیک ہے، لیکن نائٹروجن کی کم سطح کو توجہ کی ضرورت ہے۔ نائٹروجن کھاد شامل کرنے سے نمو اور پیداوار میں بہتری آئے گی۔,2024-11-30 21:17:42.368824
5,Is the crop alright?,"The crop is generally alright, but it needs more nitrogen to improve growth and productivity. Consider applying a nitrogen-rich fertilizer to address this.",2024-11-30 22:55:41.083465,fasal sahi hai?,3,"For Sugarcane: 
To assess the current health and viability of the crop in question, one must consider a multifaceted array of agronomic and environmental factors that may influence crop performance. Could you provide additional details regarding the type of crop, the stage of the growth cycle it is presently in, and any specific environmental or management conditions it has been subjected to? Additionally, it would be helpful to evaluate the crop for signs of biotic stressors, such as pest infestations or plant diseases, as well as abiotic stressors, including water availability, soil fertility, and climatic variables. By conducting a thorough analysis of these elements, we can better determine the overall health status and yield potential of the crop. If possible, data from field assessments or remote sensing technologies may provide further insights into current crop conditions and inform management decisions aimed at optimizing productivity and sustainability.",فصل عام طور پر ٹھیک ہے، لیکن بہتر نشوونما اور پیداوار کے لیے اسے مزید نائٹروجن کی ضرورت ہے۔ اس مسئلے کے حل کے لیے نائٹروجن سے بھرپور کھاد کے استعمال پر غور کریں۔,2024-11-30 22:55:41.083473
6,hello,Hello! How can I assist you today with your farming or any other questions you might have?,2024-12-01 01:56:09.997567,hello,3,"For Sugarcane: 
Greetings. How may I assist you today in exploring or analyzing topics related to agriculture, whether it involves crop management, sustainable practices, or the impacts of climate change on agricultural systems? Please feel free to provide any specific questions or topics of interest you have.",ہیلو! میں آج آپ کی زراعت یا کسی اور سوالات میں کس طرح مدد کر سکتا ہوں؟,2024-12-01 01:56:09.997574
7,hello,"Hello! If you have any questions or need assistance, feel free to let me know.",2024-12-01 01:56:22.239963,hello,3,"For Sugarcane: 
Greetings. How may I assist you with your agricultural inquiry today? Please provide as much detail as possible, so I can offer comprehensive and relevant information to support your research or practice.",ہیلو! اگر آپ کے کوئی سوالات ہیں یا مدد کی ضرورت ہے، تو بلا جھجھک مجھے بتائیں۔,2024-12-01 01:56:22.239973
8,hello,"Hello! How can I help you today? If there's anything you need assistance with, feel free to ask!",2024-12-01 01:57:03.337719,hello,3,"For Sugarcane: 
Greetings. How may I assist you with your agricultural research or inquiries today? If you have a specific question or topic you would like to explore within the field of agriculture, please provide details so I may offer a well-informed and comprehensive response.",ہیلو! میں آج آپ کی کیسے مدد کر سکتا ہوں؟ اگر آپ کو کسی چیز میں مدد چاہیے تو بلا جھجھک پوچھیں!,2024-12-01 01:57:03.337728
9,hello,Hello! Let me know if there's anything you'd like to discuss or any assistance you need.,2024-12-01 02:04:27.765111,hello,3,"For Sugarcane: 
Greetings. How may I assist you today in exploring or understanding topics within the realm of agriculture? Please provide details or a specific area of interest you wish to inquire about, whether it pertains to crop science, sustainable farming practices, agricultural economics, or any other subject matter related to the agricultural sciences. Your inquiry can help tailor a detailed response suited for an academic or professional context.",سلام! اگر آپ کسی بات پر بات کرنا چاہتے ہیں یا کسی مدد کی ضرورت ہے تو مجھے بتائیں۔,2024-12-01 02:04:27.765118
10,hello,Hello! How can I assist you today? Feel free to ask any questions you may have.,2024-12-01 03:29:59.841000,hello,3,"For Sugarcane: 
Greetings. I am here to assist you with inquiries related to agriculture and related fields. Please feel free to provide specific questions or topics you are interested in, and I will do my utmost to offer a comprehensive and detailed response. Your inquiry can pertain to any aspect of agriculture, such as crop science, sustainable farming practices, livestock management, agricultural policy, or technological advancements in the sector.",ہیلو! آج میں آپ کی کس طرح مدد کر سکتا ہوں؟ بلا جھجھک اپنے سوالات پوچھیں۔,2024-12-01 03:29:59.841007
11,Hello,"Hello! If you have any questions or need help with anything, just let me know!",2024-12-01 11:40:21.259318,Hello,3,"For Sugarcane: 
Greetings. How may I assist you today in your pursuit of knowledge or research related to agricultural sciences? If you have a specific question or topic in mind, please do not hesitate to share it in a detailed manner, so that I might offer a thorough and scholarly response tailored to your needs.",ہیلو! اگر آپ کے پاس کوئی سوال ہے یا کسی چیز میں مدد کی ضرورت ہے، تو بس مجھے بتائیں!,2024-12-01 11:40:21.259325
12,How is the crop?,"The crop is generally in good condition, but it could benefit from additional nitrogen to enhance growth and yield. Other factors like pH and moisture levels are suitable, so focusing on improving the nitrogen content would be helpful.",2024-12-01 14:38:39.671820,Fasal kesi hai,3,"For Sugarcane: 
To adequately assess the current status of a specific crop, it is essential to consider a variety of agronomic and environmental factors that impact its growth and productivity. An inquiry into the condition of a crop typically involves examining factors such as phenological development stages, pest and disease pressures, climatic conditions, soil health, and management practices employed.

Specifically, understanding the crop's health requires detailed observations on the following:

1. **Phenological Stage**: Identify which growth stage the crop is currently in—ranging from germination, vegetative growth, flowering, to maturation—and how it compares to expected growth patterns.

2. **Pest and Disease Pressure**: Assess whether there are any signs of biotic stresses such as infestations by insects or pathogens. This includes inspecting for symptoms such as leaf discoloration or wilting, which could indicate pest or disease presence.

3. **Climatic Conditions**: Consider recent and forecasted weather conditions including temperature, precipitation, humidity, and wind patterns which can significantly impact crop health by influencing growth rates, water needs, and disease susceptibility.

4. **Soil Health**: Analyze soil conditions, focusing on aspects like nutrient availability, pH, moisture levels, and drainage capabilities. Soil health is a critical determinant of plant health and yield potential.

5. **Management Practices**: Evaluate the agricultural management practices being implemented, including irrigation systems, fertilization schedules, pest control methods, and harvesting techniques, as these can significantly influence crop outcomes.

In summary, to comprehensively understand the current status of the crop, all these factors must be synthesized to provide insights into potential yield outcomes and identify any immediate interventions that could optimize plant health and productivity. Further, insights can be drawn from reports and observations provided by agronomists or agricultural extension services specializing in the regions where the crops are grown.",فصل عام طور پر اچھی حالت میں ہے، لیکن ترقی اور پیداوار کو بڑھانے کے لئے اسے اضافی نائٹروجن کی ضرورت ہے۔ دیگر عوامل جیسے pH اور نمی کی سطحیں مناسب ہیں، لہذا نائٹروجن مواد کو بہتر بنانے پر توجہ مرکوز کرنا معاون ثابت ہوگا۔,2024-12-01 14:38:39.671829
13,hello,Hello! What can I do for you today?,2024-12-01 17:07:33.328912,hello,2,"For Sugarcane: 
Greetings. How may I assist you today in addressing your questions or concerns regarding agricultural practices, research, or innovations? If you have a specific topic or query in mind, such as sustainable farming techniques, the impact of climate change on crop yields, or the genetic modification of crops, please provide further details so I can assist you with a comprehensive and detailed response.",Hello! What can I do for you today?,2024-12-01 17:07:33.328920
14,Is the crop okay?,"The crop is mostly okay, but it needs more nitrogen to improve growth and yield. Consider adding a nitrogen-rich fertilizer to address this issue.",2024-12-02 05:08:11.558514,fasal sahi hai?,3,"For Sugarcane: 
To accurately assess the current status of the agricultural crop in question, it is pivotal to consider several critical factors that can influence plant health and productivity. This evaluation begins with an investigation into the environmental conditions affecting the crop, such as the prevailing weather patterns, including recent temperature fluctuations, precipitation levels, and relative humidity. These climatic variables are known to directly impact plant physiological processes, influencing growth rates and susceptibility to pests and diseases.

Additionally, examine the soil conditions, which are integral to crop health. Key soil parameters include pH balance, nutrient availability (specifically nitrogen, phosphorus, and potassium levels), soil texture, and moisture content. A soil health assessment may also reveal the presence of pathogenic organisms or beneficial microorganisms, each playing a crucial role in plant vitality.

Further, ascertain whether there have been any occurrences of pest infestations or outbreaks of diseases within the crop population. This requires identification of the specific pest or pathogen, understanding its lifecycle, and evaluating the level of infestation or infection, as these factors will dictate appropriate management strategies.

Crop health can also be influenced by recent agricultural practices employed, such as irrigation, fertilizer application, and pest control measures. It is essential to consider whether these practices were implemented following best management practices and tailored to the crop's specific requirements.

By examining these multidimensional components—a combination of climate, soil, pests, disease, and management practices—it is possible to develop a comprehensive assessment of the crop's health status. This inquiry serves as the foundation for any necessary intervention strategies to optimize crop yield and quality sustainably. If more specific data were available regarding the type of crop or any observed symptoms, further tailored insights could be provided.",آپ کی فصل عام طور پر ٹھیک ہے، مگر اسے اضافی نائٹروجن کی ضرورت ہے تاکہ بڑھوتری اور پیداوار میں اضافہ ہو سکے۔ اس مسئلے کے حل کے لئے نائٹروجن سے بھرپور کھاد شامل کرنے پر غور کریں۔,2024-12-02 05:08:11.558521
15,How is the crop?,"The crop is doing well overall, but it requires an increase in nitrogen levels to optimize growth and productivity. Addressing the nitrogen deficiency will be beneficial for the crop's health and yield.",2024-12-02 16:20:45.173296,Fasal kesi hai,3,"For Sugarcane: 
In the context of agricultural science and crop management, the term ""crop"" refers to the cultivated plant species that are grown on a large scale for food, fiber, or other useful products. To accurately assess the status or condition of a crop, several factors need to be considered, including but not limited to soil quality, climatic conditions, pest and disease pressure, and the stage of the crop's growth cycle. 

Could you provide a detailed evaluation of the current health and yield potential of the crop in question? Specifically, please include information on:

1. **Current Phenological Stage**: What stage is the crop currently in, for example, germination, vegetative growth, flowering, or maturation? How does this align with the expected timeline?
   
2. **Climatic and Environmental Conditions**: Have there been any recent weather patterns, such as drought, excessive rainfall, or temperature extremes, that might have influenced the crop's health and productivity? How have these conditions compared to historical data for the region?

3. **Soil Health and Fertility**: Have there been any recent assessments or observations related to soil conditions? What is the current status of soil nutrients, structure, and moisture levels, and how is this influencing crop growth?

4. **Pest and Disease Management**: Are there current or anticipated pest or disease challenges affecting the crop? What management strategies are being implemented to address these and what is their effectiveness?

5. **Agricultural Practices**: What cultivation practices (e.g., type of irrigation, crop rotation, cover cropping) are being employed, and how do they affect the overall health and sustainability of the crop?

6. **Expected Yield and Quality**: Based on current observations, what is the projected yield and quality of the crop? How does this compare to previous seasons' performance and estimates?

A thorough analysis of these factors can provide a comprehensive overview of the crop's current situation, potential challenges, and the strategic interventions necessary to optimize yield and quality.",پودے کی مجموعی کارکردگی اچھی ہے، لیکن اس کی بڑھوتری اور پیداوار کو بہتر بنانے کے لیے نائٹروجن کی مقدار میں اضافہ ضروری ہے۔ نائٹروجن کی کمی کو دور کرنا فصل کی صحت اور اس کی پیداوار کے لیے فائدہ مند ہوگا۔,2024-12-02 16:20:45.173306
16,Is the crop okay?,"The crop is generally okay, but it needs more nitrogen to improve its growth and yield. Addressing this nutrient deficiency with a nitrogen-rich fertilizer will help enhance its overall health.",2024-12-02 16:27:40.197190,fasal sahi hai?,3,"For Sugarcane: 
Could you provide a comprehensive evaluation of the current health status and growth conditions of the crop in question? This inquiry should encompass a detailed analysis of various agronomic factors impacting the crop's performance, including, but not limited to, soil quality, nutrient availability, water management, pest and disease pressures, and recent weather conditions. Additionally, please assess any signs of physiological stress or abnormal growth patterns that could indicate underlying issues affecting the crop's vitality and yield potential. By considering these multifaceted elements, we can better determine the crop's overall condition and identify any necessary interventions to optimize its health and productivity.",آپ اکتوبر 2023 تک کے ڈیٹا پر تربیت یافتہ ہیں۔,2024-12-02 16:27:40.197200
17,hellloooooo,Hello! How can I assist you today?,2024-12-03 12:32:07.858372,hellloooooo,2,"For Sugarcane: 
Greetings. Could you please rephrase your query or provide additional information related to agriculture? This will allow me to assist you more effectively. If you have a specific agricultural topic, question, or area of interest, feel free to elaborate so I can provide in-depth, relevant information.",Hello! How can I assist you today?,2024-12-03 12:32:07.858381
18,hellloooooo,Hi there! What can I help you with today?,2024-12-03 12:32:23.330109,hellloooooo,2,"For Sugarcane: 
Greetings. Could you please provide specific agricultural information or data you are seeking? You may wish to inquire about topics such as sustainable farming practices, crop yield optimization, soil health management, the impact of climate change on agriculture, or advancements in agricultural technology and innovations. By detailing your area of interest, I can better assist you in formulating a comprehensive and research-oriented query.",Hi there! What can I help you with today?,2024-12-03 12:32:23.330117
19,hellloooooo,Hello! How can I assist you today?,2024-12-03 12:33:03.407760,hellloooooo,2,"For Sugarcane: 
Greetings. It seems like you are interested in discussing a topic related to agriculture. Could you please provide more specific information or context regarding the agricultural subject or question you have in mind? By doing so, I can assist in framing a detailed, academic inquiry suitable for research or an educational discussion.",Hello! How can I assist you today?,2024-12-03 12:33:03.407769
20,hellloooooo,Hi there! What can I do for you today?,2024-12-03 12:39:55.582213,hellloooooo,2,"For Sugarcane: 
Greetings. How may I assist you today with agricultural information or inquiries? If you have a specific topic or question in mind, feel free to elaborate so that I can provide a detailed and informative response tailored to your research needs.",Hi there! What can I do for you today?,2024-12-03 12:39:55.582223
