id,translated_message,response,created_at,message,user_id,rag_message,translated_response,updated_at
40,How is the crop?,"The sugarcane crop on your farmland seems to be generally stable, but there are a few things to note. The pH level is neutral, which is good for sugarcane. However, your current nitrogen levels are low compared to previous records, and temperature is a bit on the cooler side, which may affect growth. Consider using a nitrogen-rich fertilizer and monitor the temperature.",2024-12-08 09:44:03.273868,Fasal kesi hai,5,"For sugarcane: 
To assess the current status and health of a specific crop, a comprehensive evaluation must be conducted encompassing several agronomic factors. Such an evaluation should include an analysis of plant growth stages, vigor, pest and disease presence, and any abiotic stress factors like drought, nutrient deficiencies, or extreme weather events. Furthermore, it is essential to consider the crop's yield potential based on current field conditions and management practices.

Farmers and agronomists can rely on various methodologies, such as remote sensing technologies, which utilize satellite imagery to monitor large-scale crop health and development. Additionally, ground-based techniques like soil testing and tissue analysis can provide insights into nutrient availability and uptake, which are critical for growth.

Given these multifaceted aspects, the inquiry should detail the specific crop in question, the geographic and climatic conditions of the location, and any recent agronomic practices employed. This detailed assessment could aid in determining the crop's performance within an agroecological and socioeconomic context, thereby facilitating targeted interventions for improving productivity and sustainability.",آپ کی جائیداد میں گنے کی فصل مجموعی طور پر مستحکم لگتی ہے، لیکن کچھ چیزیں نوٹ کرنے کی ہیں۔ pH سطح معتدل ہے، جو گنے کے لئے اچھی بات ہے۔ تاہم، آپ کی موجودہ نائٹروجن کی سطح پہلے کے ریکارڈ کے مقابلے میں کم ہے، اور درجہ حرارت تھوڑا ٹھنڈا ہے، جو کہ بڑھوتری کو متاثر کر سکتا ہے۔ ایک نائٹروجن سے بھرپور کھاد کا استعمال کرنے پر غور کریں اور درجہ حرارت کی نگرانی کریں۔,2024-12-08 09:44:03.273877
41,What is the pH?,"The current soil pH is 7.2, which is slightly above the optimal range of 5.5 to 6.5 for sugarcane. Consider steps to slightly lower the pH, such as applying sulfur, to enhance nutrient uptake and improve crop health.",2024-12-08 09:44:44.396339,pH Kitna hai,5,"For sugarcane: 
The term ""pH"" refers to a scale used to specify the acidity or alkalinity of an aqueous solution, which is a critical factor in agricultural sciences due to its influence on soil chemistry and plant growth. The pH scale ranges from 0 to 14, with a value of 7 representing a neutral solution, values less than 7 indicating acidity, and values greater than 7 denoting alkalinity. 

In the context of soil science, soil pH is a vital indicator of soil health, affecting the availability of nutrients to plants, microbial activity, and the solubility of toxic elements. Optimal soil pH varies according to plant species; for instance, most agricultural crops thrive in soils with a pH range of 6 to 7.5, wherein nutrient availability aligns with the plants’ requirements. Understanding and managing soil pH is essential for maximizing crop yields; this often involves practices such as liming acidic soils or applying sulfur to alkaline soils to bring the pH to desired levels.

Therefore, could you please clarify whether you are inquiring about the pH of soil, a specific solution, or another agricultural material? Further details will help tailor the response to address the specific pH-related issues relevant to your particular interest in the field of agriculture.",آپ کو اکتوبر 2023 تک کے ڈیٹا پر تربیت دی گئی ہے۔,2024-12-08 09:44:44.396357
42,What is the pH,The soil pH for your crop is currently 7.1.,2024-12-08 09:45:20.815044,pH kitna hai,3,"For Sugarcane: 
In the context of agriculture, pH is a critical parameter that refers to the measure of acidity or alkalinity in soils or water solutions, with a scale ranging from 0 to 14. This parameter is essential for managing soil health, as it directly influences the availability of nutrients to plants, the activity of soil microorganisms, and the overall soil structure.

The pH scale is logarithmic, where a pH value of 7 is considered neutral. Values below 7 denote increasing acidity, whereas values above 7 indicate increasing alkalinity. Soil pH affects the solubility of minerals and nutrients, thereby affecting plant growth and crop yields. For instance, most agricultural crops thrive best in soils with a pH between 6 and 7.5, where the availability of essential nutrients such as nitrogen, phosphorus, and potassium is optimized.

Furthermore, pH management is vital for sustainable agricultural practices. It requires regular soil testing and, if necessary, amendment application such as lime to raise soil pH (reduce acidity) or sulfur to lower pH (reduce alkalinity). Understanding the soil pH and making precise adjustments can enhance plant health, increase resistance to pests and diseases, and optimize yield.

In scientific research, understanding variations in pH can also offer insights into environmental changes, pollution levels, and land management practices. Thus, exploring the concept of soil and water pH within agriculture involves a multidisciplinary approach, incorporating aspects of soil science, environmental chemistry, and sustainable agricultural practices. Would you like more detailed information on how soil pH is measured or how it impacts specific crops?",آپ کی فصل کے لئے مٹی کا پی ایچ فی الحال 7.1 ہے۔,2024-12-08 09:45:20.815051
43,What is the pH?,The current soil pH is 7.2.,2024-12-08 09:45:50.438495,pH Kitna hai,5,"For sugarcane: 
In the context of agriculture, pH is a fundamental parameter that denotes the acidity or alkalinity level of a given soil sample. It is measured on a logarithmic scale ranging from 0 to 14, where values below 7 indicate acidic conditions, values around 7 denote neutrality, and values above 7 suggest alkaline conditions. The pH scale is a critical factor affecting soil health and agricultural productivity since it influences the availability of essential nutrients to plants, microbial activity, and overall soil structure.

Soil pH can have profound impacts on crop performance. For instance, certain nutrients such as nitrogen, phosphorus, and potassium become less available to plants in highly acidic or alkaline soils, thus affecting plant growth and yield. Additionally, soil pH affects the solubility of potentially toxic elements, such as aluminum and manganese, which can become more soluble and harmful to plant roots in low pH conditions.

Farmers and agricultural scientists routinely measure and manage soil pH to optimize crop performance. This management may include practices such as the application of lime to raise the pH of acidic soils or sulfur to lower the pH of alkaline soils. Understanding the pH requirements of specific crops is vital for formulating effective soil management strategies. An inquiry into soil pH should ideally be supplemented with a discussion of its implications on agronomic practices and its role in sustainable agricultural systems.",موجودہ مٹی کا پی ایچ 7.2 ہے۔,2024-12-08 09:45:50.438503
44,How much is nitrogen?,The most recent nitrogen level in your soil is 7.0 mg/kg.,2024-12-08 10:20:18.610045,نائٹروجن کتنی ہے,4,"For sugarcane: 
To accurately address the inquiry regarding the availability and pricing of nitrogen fertilizers, one must consider various factors influencing the cost and use of nitrogen in agricultural practices. Nitrogen is a fundamental element utilized predominantly in the form of nitrogen-based fertilizers, including substances such as urea, ammonium nitrate, and ammonia. These compounds play a critical role in enhancing soil fertility and promoting plant growth by facilitating essential biochemical processes such as photosynthesis and protein synthesis.

The price of nitrogen fertilizers is subject to fluctuation based on several determinants. Key factors include global supply and demand dynamics, fluctuations in raw material costs (such as natural gas for ammonia production), geopolitical influences, and the logistical considerations of distribution. Additionally, regional agricultural practices, policies, and environmental regulations also impact pricing. 

To acquire precise and current information regarding the price of nitrogen fertilizers, consulting agricultural market reports, analyzing trade data, or reaching out to local agricultural suppliers or extension services would be prudent. These sources can provide insights into the economic and practical aspects of nitrogen usage in agriculture, helping farmers and stakeholders make informed decisions related to crop management and budget planning.",آپ کی مٹی میں حالیہ نائٹروجن کی سطح 7.0 ملی گرام/کلوگرام ہے۔,2024-12-08 10:20:18.610053
45,How much potassium?,The latest recorded potassium level in your soil is 55.0 mg/kg.,2024-12-08 12:43:46.349451,How much potassium?,4,"For sugarcane: 
To accurately address your inquiry regarding the optimal amount of potassium required in an agricultural context, it is important to consider several factors related to both the specific crop and the prevailing soil conditions. 

Potassium (K) is a vital macronutrient that plays a crucial role in plant physiology, including the regulation of water uptake through osmoregulation, activation of various enzyme systems, and enhancement of photosynthesis processes. Additionally, potassium influences the strength of plant tissues and bolsters resistance to diseases. The requirement for potassium can differ significantly based on the type of crop, its growth stage, and the soil's inherent nutrient composition.

An accurate assessment begins with soil testing to determine the existing potassium levels, often expressed in parts per million (ppm), as well as its availability, which can be influenced by soil texture, pH, and cation exchange capacity. For instance, clay soils may retain potassium more effectively than sandy soils, which are prone to leaching.

Crop-specific recommendations vary; for example, potassium requirements for high-demand crops like potatoes or tomatoes are substantially different from those for grains such as wheat or maize. Furthermore, the absorption efficiency of potassium by plants can be affected by interactions with other nutrients, such as the antagonistic relationship with calcium and magnesium.

In light of these considerations, it would be prudent to consult agronomic guidelines and fertilizer recommendations, often provided by agricultural extension services or research institutions, to determine the precise potassium fertilizer application rates tailored to your specific situational parameters.",آپ کی مٹی میں درج شدہ تازہ ترین پوٹاشیم کی سطح 55.0 مگراگرام/ کلوگرام ہے۔,2024-12-08 12:43:46.349459
46,Tell the soil's pH level.,The current soil pH level is 6.8.,2024-12-09 01:22:31.339189,مٹی کا پی ایچ لیول بتائے,5,"For sugarcane: 
Please provide an in-depth analysis of the soil pH level, focusing on its significance in agricultural contexts. Discuss the implications of varying pH levels on soil chemistry and plant growth, including nutrient availability, microbial activity, and plant root development. Additionally, elucidate the methodologies used to measure soil pH, such as soil sampling and laboratory testing or in-situ testing using pH meters. Consider examining the impact of soil amendments, such as lime or sulfur, in altering soil pH to optimize crop production. Furthermore, connect soil pH levels to broader agricultural challenges and sustainable practices, addressing how appropriate pH management can mitigate issues such as soil degradation or poor crop yield. Lastly, explore the role of climate and regional soil profiles in influencing natural pH variations and how these factors affect agricultural planning and environmental conservation.",موجودہ مٹی کا پی ایچ لیول 6.8 ہے۔,2024-12-09 01:22:31.339198
47,hello,"Hello! How can I help you today? If you have any questions or need assistance, feel free to ask!",2024-12-10 06:44:08.320511,hello,3,"For Sugarcane: 
Greetings. If you have a specific inquiry related to the field of agriculture or a topic you wish to explore in depth, please feel free to articulate your question or area of interest. By providing detailed context or specifying the scope of your inquiry, such as sustainable farming practices, crop yield optimization, or the impact of climate change on agricultural systems, I can offer more comprehensive and informed assistance.",ہیلو! آج میں آپ کی کیسے مدد کر سکتا ہوں؟ اگر آپ کے پاس کوئی سوالات ہیں یا مدد کی ضرورت ہے تو بلا جھجھک پوچھیں!,2024-12-10 06:44:08.320521
48,How is the weather?,"The current weather in Lahore is overcast with a temperature of 13.1°C, a wind speed of 7.2 km/h, and a humidity level of 77%. There has been no precipitation reported recently.",2024-12-10 17:48:45.243971,فصل کا کیا حال ہے,4,"For sugarcane: 
Could you provide a detailed analysis of current meteorological conditions as they pertain to agricultural practices within a specific region? This analysis should include information about temperature, precipitation patterns, humidity levels, wind speeds, and any notable weather anomalies. Additionally, please discuss how these conditions might affect crop growth stages, soil moisture content, pest and disease prevalence, and potential implications for irrigation management and harvesting schedules. Understanding these factors is crucial for developing adaptive strategies to mitigate climate-related risks in agricultural operations.",آپ اکتوبر 2023 تک کے ڈیٹا پر تربیت یافتہ ہیں۔,2024-12-10 17:48:45.243979
49,How is the weather فصل?,"Currently, the weather in Lahore is cool with overcast skies, typical of the early winter season. Temperatures range from 10°C to 20°C, with low humidity, which is common for December in this region.",2024-12-10 19:49:20.222313,فصل کا کیا حال ہے,4,"For sugarcane: 
The inquiry concerning the impact of weather on agricultural processes necessitates a detailed examination of how seasonal climatic conditions influence crop yield, soil health, and overall farming operations. Specifically, when assessing the weather across different seasons ('فصل', which is the Arabic term for 'season'), it is important to consider the distinct meteorological factors that characterize each period of the year, such as temperature variations, precipitation levels, humidity, and sunlight exposure.

For example, the spring season is typically associated with moderate temperatures and increased rainfall, which can facilitate the germination and initial growth phases of many crops. Conversely, the summer season often brings higher temperatures and, depending on the region, either drought conditions or thunderstorms, each presenting different challenges and opportunities for irrigation management and pest control.

The autumn season might be critical for the harvest phase, where weather stability can influence the timing and efficiency of harvesting operations, while winter season conditions can affect soil nutrient availability and necessitate strategies for soil protection and maintenance.

Understanding these seasonal dynamics is essential for developing adaptive agricultural strategies that optimize crop performance and sustainability. Therefore, when inquiring about how the weather affects agricultural practices, one should consider not only the immediate implications of weather changes but also their long-term effects on agricultural ecosystems and productivity.",آپ اکتوبر 2023 تک کے ڈیٹا پر تربیت یافتہ ہیں۔,2024-12-10 19:49:20.222320
50,What are the conditions of the crop?,"The crop conditions are generally favorable, with good pH and moisture levels, but the nitrogen level is low, which could impact growth. To enhance yield and plant health, consider applying a nitrogen-rich fertilizer.",2024-12-11 16:12:53.505577,Fasal ke kia halaat hain,3,"For Sugarcane: 
In order to comprehensively assess the conditions of a particular crop, one must consider a multifaceted array of factors that collectively influence crop health and productivity. These conditions encompass several key areas:

1. **Climatic Factors**: Understanding the local climate conditions is crucial, as crops are highly sensitive to variations in temperature, light, and precipitation. Optimal growth requires specific climate parameters which, if not met, could lead to stress or hindered development. For instance, temperature fluctuations can affect metabolic and physiological processes, while inadequate precipitation may lead to drought stress.

2. **Soil Health**: The soil environment, including its physical structure, nutrient content, pH level, and microbial activity, plays a critical role in crop development. Healthy soil with adequate organic matter and nutrient availability supports robust root growth and nutrient uptake. Soil testing can help determine fertility levels and inform decisions regarding fertilization and soil amendment.

3. **Pest and Disease Pressure**: Crops are susceptible to a range of biotic stressors such as insects, weeds, and pathogens. Monitoring pest populations and disease incidence is vital for the implementation of integrated pest management (IPM) strategies. Effective control measures help to reduce the yield losses and quality degradation associated with these biotic threats.

4. **Water Management**: Adequate irrigation practices and water management are essential, particularly in regions affected by water scarcity. Insufficient or excessive watering can lead to conditions such as drought stress or waterlogging, both of which adversely affect crop yield and quality.

5. **Nutrient Management**: Proper fertilization is critical to meet the nutritional demands of the crop throughout its growth stages. The availability of macronutrients like nitrogen, phosphorus, and potassium, as well as micronutrients such as zinc and manganese, plays a pivotal role in crop vigor and productivity. Nutrient imbalances or deficiencies can result in stunted growth and lower yields.

6. **Crop Management Practices**: Techniques such as crop rotation, tillage, and the use of cover crops can impact crop health. Innovative approaches should be adapted based on regional practices to enhance sustainability and resilience against environmental stresses.

By evaluating these parameters, one can gain a thorough understanding of the current condition of the crop, which can further guide management decisions and interventions to optimize yield and quality outcomes. Such an assessment is fundamental for researchers, agronomists, and farmers alike looking to enhance agricultural productivity in a sustainable manner.",فصل کی حالتیں عام طور پر سازگار ہیں، پی ایچ اور نمی کی سطح اچھی ہے، لیکن نائٹروجن کی سطح کم ہے، جو بڑھوتری کو متاثر کر سکتی ہے۔ پیداوار اور پودے کی صحت کو بہتر بنانے کے لیے نائٹروجن سے بھرپور کھاد لگانے پر غور کریں۔,2024-12-11 16:12:53.505585
51,How is the season?,"The sugarcane growing season currently has cooler temperatures than optimal, as sugarcane thrives best above 20°C. The dry and cool conditions can help the crop as it matures, but you'll need to manage irrigation carefully to maintain adequate soil moisture.",2024-12-11 16:17:17.702536,فصل کی حالت کیسی ہے؟,3,"For Sugarcane: 
Could you provide a comprehensive overview of the current agricultural season within a specific region, detailing the predominant climatic conditions, expected precipitation patterns, and temperature variations? Additionally, elucidate how these atmospheric factors influence crop development, planting schedules, and harvest timings. Please include any region-specific challenges that might arise due to atypical weather patterns, such as droughts, heatwaves, or unexpected frost, and discuss any adaptive strategies or technologies that farmers are employing to mitigate these challenges. Furthermore, an examination of the season's impact on soil conditions, pest populations, and overall ecosystem health would provide valuable insights for assessing agricultural productivity during this period.",گنا کے کاشت کے موجودہ موسم میں درجہ حرارت معمول سے کم ہے کیونکہ گنا 20°C سے اوپر بہتر انداز میں بڑھتا ہے۔ خشک اور ٹھنڈے حالات فصل کی پختگی میں مدد کر سکتے ہیں، لیکن آپ کو مناسب مٹی کے نمی کو برقرار رکھنے کے لئے آبپاشی کو احتیاط سے منظم کرنے کی ضرورت ہوگی۔,2024-12-11 16:17:17.702544
52,What is pH?,The soil pH for your sugarcane crop is currently 5.9.,2024-12-11 16:24:20.092102,پی ایچ کیا ہے؟,3,"For Sugarcane: 
The concept of pH, which stands for ""potential of hydrogen,"" is a critical parameter in both soil science and agronomy, as it quantifies the acidity or alkalinity of a substance on a logarithmic scale ranging from 0 to 14. This scale is utilized to determine hydrogen ion concentration within a solution, with lower values indicating higher acidity and higher values signifying increased alkalinity. A pH of 7 is considered neutral, such as that of pure water. 

In agricultural contexts, soil pH significantly influences nutrient availability, microbial activity, and overall plant health. Many crops have specific pH requirements for optimal growth. For example, most agricultural soils are classified as slightly acidic to neutral (pH 6 to 7) to maintain nutrient accessibility, as extreme acidity or alkalinity can lead to nutrient deficiencies or toxicities that impair crop productivity.

Adjustments to soil pH can be achieved through management practices, such as liming acidic soils with calcium carbonate to raise pH, or applying elemental sulfur to alkaline soils to lower pH. Understanding and managing soil pH is, therefore, crucial for ensuring sustainable crop production and maximizing agricultural yields. 

Researchers and practitioners in agriculture continuously explore the impacts of pH on soil biota, plant-microbe interactions, and how pH alterations can mitigate environmental challenges like soil degradation. Would you like more information on the methods for measuring soil pH or techniques to adjust it for specific crops?",آپ کی گنے کی فصل کے لیے مٹی کا pH اس وقت 5.9 ہے۔,2024-12-11 16:24:20.092112
53,hello,Hello! What can I do for you today?,2024-12-11 21:55:58.771581,hello,2,"For Sugarcane: 
Greetings. How may I assist you today with inquiries pertaining to agricultural research, practices, or any related topics? Please feel free to provide specific questions or themes you are interested in, and I will be delighted to offer detailed and well-informed responses.",Hello! What can I do for you today?,2024-12-11 21:55:58.771590
