translated_message,id,response,created_at,user_id,message,rag_message,translated_response,updated_at
When is the spinach crop watered?,1,"Water spinach early in the morning or late afternoon to minimize water loss and keep the soil consistently moist. Pay special attention to watering during dry spells, as spinach prefers evenly moist soil for optimal growth.",2025-01-31 10:34:59.952104,7,پالک کی فصل کو کب پانی لگتا ہے؟,"For green pea: 
What are the optimal watering schedules for spinach crops to ensure healthy growth?",آپ کے پاس اکتوبر 2023 تک کے ڈیٹا کی تربیت ہے۔,2025-01-31 10:34:59.952115
اسلام علیکم یار مجھے یہ بتاؤ میری فصل کے اندر حالات کیا چل رہے ہیں؟ کیا صورتحال ہے؟ کیا چل رہا ہے؟,2,وعلیکم السلام! آپ کی فصل کی موجودہ ریڈنگز کے مطابق، سب کچھ مناسب نظر آ رہا ہے۔ مٹی کی pH تقریباً 6.7 ہے، جو ایلو ویرا کے لیے اچھا ہے، جبکہ درجہ حرارت 16-17°C کے درمیان ہے۔ نائٹروجن اور پوٹاشیم کی سطح بھی معتدل ہیں، بس اس بات کا دھیان رکھیں کہ موسمی حالات کے مطابق فصل کو دیکھ بھال ملے۔,2025-02-14 12:20:47.353050,2,اسلام علیکم یار مجھے یہ بتاؤ میری فصل کے اندر حالات کیا چل رہے ہیں؟ کیا صورتحال ہے؟ کیا چل رہا ہے؟,"For Sugarcane: 
وعلیکم السلام، کیا آپ اپنی فصل کی نشوونما، بیماریوں، یا موسمی حالات کے بارے میں جانکاری حاصل کرنا چاہتے ہیں؟ مزید معلومات فراہم کریں تاکہ میں آپ کی بہتر رہنمائی کر سکوں۔",وعلیکم السلام! آپ کی فصل کی موجودہ ریڈنگز کے مطابق، سب کچھ مناسب نظر آ رہا ہے۔ مٹی کی pH تقریباً 6.7 ہے، جو ایلو ویرا کے لیے اچھا ہے، جبکہ درجہ حرارت 16-17°C کے درمیان ہے۔ نائٹروجن اور پوٹاشیم کی سطح بھی معتدل ہیں، بس اس بات کا دھیان رکھیں کہ موسمی حالات کے مطابق فصل کو دیکھ بھال ملے۔,2025-02-14 12:20:47.353058
ओ यारा मेरी फसल देकी हाल चल रहा है कि सब कुछ सह जाएगा,3,آپ کی فصل کے موجودہ حالات اچھے نظر آ رہے ہیں۔ مٹی کی pH 5.8 ہے، جو ایلو ویرا کے لیے مناسب ہے، اور درجہ حرارت بھی فصل کی بڑھوتری کے لحاظ سے ٹھیک ہے۔ نائٹروجن کی سطح کو مزید بہتر بنانے سے پیداوار میں بہتری آ سکتی ہے، لہذا اس پر توجہ دینا فائدہ مند ہوگا۔,2025-02-18 08:56:00.477821,2,ओ यारा मेरी फसल देकी हाल चल रहा है कि सब कुछ सह जाएगा,"For Sugarcane: 
क्या मेरी फसल की वर्तमान स्थिति को सुधारने के लिए कोई उपाय या सुझाव दे सकते हैं?",آپ کی فصل کے موجودہ حالات اچھے نظر آ رہے ہیں۔ مٹی کی pH 5.8 ہے، جو ایلو ویرا کے لیے مناسب ہے، اور درجہ حرارت بھی فصل کی بڑھوتری کے لحاظ سے ٹھیک ہے۔ نائٹروجن کی سطح کو مزید بہتر بنانے سے پیداوار میں بہتری آ سکتی ہے، لہذا اس پر توجہ دینا فائدہ مند ہوگا۔,2025-02-18 08:56:00.477830
hello,4,Hello! How can I assist you today?,2025-03-05 14:33:56.861879,3,hello,"For Sugarcane: 
Hello! How may I assist you with your agriculture-related inquiry?",آپ اکتوبر 2023 تک کے ڈیٹا پر تربیت یافتہ ہیں۔,2025-03-05 14:33:56.861891
