id,translated_message,response,created_at,message,user_id,rag_message,translated_response,updated_at
54,ہاں میری فصل کے حالات کیسے ہیں؟ مجھے ایک ریویو دے کے بتانا,آپ کی زمین کی حالیہ ریڈنگز سے معلوم ہوتا ہے کہ ایلو ویرا کی فصل ٹھیک حالت میں ہے۔ مٹی کی pH 5.9 ہے، جو ایلو ویرا کے لیے مناسب ہے، اور موجودہ درجہ حرارت 12°C کے قریب ہے، جو قدرے ٹھنڈا ہے لیکن ابھی بھی برداشت کے دائرے میں ہے۔ آپ کو پانی کی نکاسی پر توجہ دینی چاہیے تاکہ جڑیں خراب نہ ہوں اور یہ بھی یقینی بنائیں کہ نائٹروجن کی سطح بہتر کرنے کے لیے کھاد استعمال کریں۔,2024-12-11 21:56:52.512726,ہاں میری فصل کے حالات کیسے ہیں؟ مجھے ایک ریویو دے کے بتانا,2,"For Sugarcane: 
کاشتکار کے نقطہ نظر سے، فصل کی موجودہ حالت کے بارے میں جاننا کسی بھی زراعتی عمل کی کامیابی کے لیے نہایت اہمیت کا حامل ہے۔ فصل کی حالت کا جائزہ لینے میں کئی عوامل شامل ہوتے ہیں جن میں مٹی کی خصائص، آب و ہوا کے حالات، بیماریوں یا کیڑوں کا حملہ، اور فصل کی نشو و نما کے مختلف مراحل شامل ہیں۔

فصل کی حالت کے بارے میں تفصیلی جائزہ حاصل کرنے کے لئے سب سے پہلے مٹی کا تجزیہ ضروری ہے۔ مٹی کے اندر موجود معدنیات، پی ایچ لیول، اور نمی کی مقدار فصل کی صحت پر بڑا اثر ڈال سکتے ہیں۔ اس کے علاوہ، موسمیاتی حالات، جیسے درجہ حرارت، بارش کی مقدار، اور ہوا کی نمی، بھی فصل کی ترقی کو متاثر کرتے ہیں۔

اسی طرح، فصل کی بیماریوں یا کیڑوں کے اثرات کا تجزیہ کرنا ضروری ہوتا ہے، کیوں کہ ان عوامل کی موجودگی فصل کی پیداور میں کمی یا نقصانات کا باعث بن سکتی ہے۔ فیلڈ میں موجود ماہرین اور ایگریکلچر ڈرونز یا سیٹلائٹس کی مدد سے فصل کا معائنہ کرکے ان چیلنجز کی شناخت کی جا سکتی ہے۔

حاصل کردہ ڈیٹا کی روشنی میں، موجودہ زرعی تحقیق اور تکنیکی وسائل کا استعمال کرتے ہوئے دانشمندانہ فیصلے کیے جا سکتے ہیں، تاکہ پیداوارکو بہتر اور معیاری بنایا جا سکے۔ کیا آپ کو مزید تفصیلی معلومات یا کسی خاص قسم کی فصل کے بارے میں مشورہ درکار ہے؟",آپ کی زمین کی حالیہ ریڈنگز سے معلوم ہوتا ہے کہ ایلو ویرا کی فصل ٹھیک حالت میں ہے۔ مٹی کی pH 5.9 ہے، جو ایلو ویرا کے لیے مناسب ہے، اور موجودہ درجہ حرارت 12°C کے قریب ہے، جو قدرے ٹھنڈا ہے لیکن ابھی بھی برداشت کے دائرے میں ہے۔ آپ کو پانی کی نکاسی پر توجہ دینی چاہیے تاکہ جڑیں خراب نہ ہوں اور یہ بھی یقینی بنائیں کہ نائٹروجن کی سطح بہتر کرنے کے لیے کھاد استعمال کریں۔,2024-12-11 21:56:52.512734
55,How is the season's condition?,"The season's conditions are cooler than ideal for sugarcane, with temperatures below the optimal range of 20°C to 30°C. There hasn't been any recent rainfall, so ensure proper irrigation to maintain adequate soil moisture levels.",2024-12-12 20:30:14.833319,فصل کی حالت کیسی ہے؟,3,"For Sugarcane: 
Please provide an in-depth analysis of the current agro-climatic conditions for the ongoing agricultural season in a specified region. This inquiry should encompass an evaluation of various meteorological and environmental parameters, such as temperature, precipitation levels, humidity, and wind patterns, which are pivotal in determining the season's suitability for crop growth. Additionally, consider factors such as the timing of the planting period, potential deviations from typical weather patterns, and any early indications of pest and disease prevalence. It would also be beneficial to discuss the implications of these conditions on crop yield projections and recommend strategies for mitigating adverse impacts. This information will aid in developing a comprehensive understanding of this season's environmental conditions and their potential effects on agricultural productivity and sustainability.",موسم کی حالتیں گنّے کے لئے آئیڈیل سے زیادہ ٹھنڈی ہیں، اور درجہ حرارت مثالی حد 20°C سے 30°C کے نیچے ہے۔ حال ہی میں کوئی بارش نہیں ہوئی ہے، لہٰذا مناسب آبپاشی کو یقینی بنائیں تاکہ زمین کی نمی کی سطحیں مناسب رہ سکیں۔,2024-12-12 20:30:14.833327
56,hello,Hello! How can I assist you today?,2024-12-13 21:06:13.669132,hello,2,"For Sugarcane: 
Greetings. If you have any specific inquiries or topics related to agriculture that you wish to explore, please feel free to provide the details. I am here to assist you in formulating a well-structured and research-oriented query suitable for obtaining comprehensive insights or data on agricultural practices, advancements, challenges, or scientific studies.",Hello! How can I assist you today?,2024-12-13 21:06:13.669138
57,How is the season's condition?,"The season is currently cooler and dry, which isn't ideal for sugarcane's optimal growth, but manageable with proper irrigation. Maintaining adequate moisture levels will be important as temperatures are below the preferred range for sugarcane.",2024-12-13 22:11:39.475478,فصل کی حالت کیسی ہے؟,3,"For Sugarcane: 
To provide a comprehensive analysis of the current seasonal conditions affecting agricultural practices, it is essential to consider multiple factors such as climatic patterns, soil health, crop cycle, and regional microclimates. Seasonal conditions in agriculture can greatly influence crop yield, pest and disease prevalence, water availability, and overall farm management strategies. 

This inquiry would benefit from an examination of meteorological data, including temperature, precipitation, humidity levels, and any pertinent extreme weather events such as droughts, floods, or high winds that have occurred in the region. Additionally, understanding the seasonal forecast—possibly influenced by long-term climate phenomena like El Niño or La Niña—could provide insight into future challenges or opportunities.

The assessment should also incorporate an evaluation of agronomic practices being used to mitigate adverse seasonal impacts, such as crop rotation, cover cropping, irrigation management, and soil conservation techniques. Lastly, the implications of these seasonal conditions on economic factors, such as supply chain disruptions and market price volatility, should also be considered to develop a holistic understanding of agriculture during this particular season.",آپ اکتوبر 2023 تک کے ڈیٹا پر تربیت یافتہ ہیں۔,2024-12-13 22:11:39.475486
58,How is the season's condition?,"The season is currently cooler and dry, which can slow sugarcane growth since it prefers warmer temperatures. Ensure adequate irrigation to maintain soil moisture and support the crop under these conditions.",2024-12-15 00:12:24.412538,فصل کی حالت کیسی ہے؟,3,"For Sugarcane: 
To comprehensively assess the current condition of the agricultural season, it is imperative to consider a variety of climatological and environmental factors that influence crop production cycles. These factors encompass meteorological conditions such as temperature, precipitation, and humidity levels; all of which directly affect plant growth and development. Additionally, soil health and moisture content play critical roles in determining the vitality and yield potential of crops. It is also essential to consider the phenological stages of key crops, as these will vary based on regional climatic patterns and specific cultivar requirements. Moreover, the presence of abiotic stressors, such as drought or frost, and biotic stressors, including pest and disease pressures, must be evaluated to determine their potential impact on agricultural productivity. Evaluating the season's condition requires an integrative approach, synthesizing data from satellite imagery, weather forecasts, and field observations to provide a robust and comprehensive analysis. Such an evaluation facilitates informed decision-making for farmers and policymakers, aiming to optimize resource use and enhance food security.",موسم اس وقت ٹھنڈا اور خشک ہے، جو گنے کی نشوونما کو سست کر سکتا ہے کیونکہ یہ گرم درجہ حرارت کو ترجیح دیتا ہے۔ ان حالات میں فصل کی مدد کے لئے مٹی کی نمی کو برقرار رکھنے کے لیے مناسب آبپاشی یقینی بنائیں۔,2024-12-15 00:12:24.412547
59,How much is PH,The latest recorded soil pH of your farmland is 7.1.,2024-12-15 17:00:35.786086,PH kitna ha,4,"For sugarcane: 
In the context of agriculture, the term ""pH"" refers to a scale used to quantify the acidity or alkalinity of soil, which is a critical factor in agricultural productivity. The pH scale ranges from 0 to 14, with 7 being neutral. Values below 7 indicate acidic conditions, while values above 7 represent alkaline conditions. Understanding soil pH is crucial because it affects nutrient availability to plants, microbial activity, and overall soil health.

In agricultural practice, soil pH can significantly influence the types of crops that can be grown effectively. For instance, most crops prefer a slightly acidic to neutral pH range of 6.0 to 7.0, as extreme pH levels can limit nutrient uptake and affect plant growth. Acidic soils, with pH values below 6, might require liming to raise the pH, while highly alkaline soils might need sulfur or other amendments to lower the pH and make the environment more suitable for plant growth.

Therefore, a comprehensive understanding of soil pH and its management is essential for optimizing crop yield and ensuring sustainable agricultural practices. If you have a specific soil sample's pH value or region you are interested in examining further, please provide additional details for more tailored information.",آپ کی زرعی زمین کی مٹی کا حالیہ ریکارڈ شدہ پی ایچ 7.1 ہے۔,2024-12-15 17:00:35.786094
60,Is nitrogen enough?,"The current nitrogen level in your soil is above optimal levels, particularly given past records having higher levels at 60 mg/kg, potentially indicating excess. Typically, adequate nitrogen levels for sugarcane should balance with other nutrients to avoid wastage and ensure proper growth, so it might be worthwhile to assess plant health and adjust accordingly.",2024-12-15 17:01:56.727151,Kia nitrogen kafi ha?,4,"For sugarcane: 
The inquiry regarding the sufficiency of nitrogen as a singular nutrient in agricultural practices invites a deeper exploration into the complexities of plant nutrition and soil fertility. Nitrogen is indeed a critical macronutrient essential for plant growth, as it is a fundamental building block of amino acids, proteins, and nucleic acids. It plays a pivotal role in photosynthesis and energy transfer within plant tissues.

However, while nitrogen is paramount, it is not the sole nutrient required by plants to achieve optimal growth and productivity. Plants necessitate a balanced supply of macronutrients and micronutrients. Apart from nitrogen, key macronutrients include phosphorus and potassium, which are vital for root development and fruit/flower formation, respectively. Additionally, calcium, magnesium, and sulfur contribute to plant structural integrity and enzymatic functions.

Equally important are the micronutrients, such as iron, manganese, zinc, copper, molybdenum, boron, and chlorine, which, although required in lesser amounts, are crucial for the activation of enzyme systems and overall plant health.

Furthermore, the nitrogen cycle in agricultural systems is complex, involving processes such as nitrogen fixation, mineralization, nitrification, and denitrification, each influenced by environmental conditions such as soil pH, moisture content, temperature, and the presence of nitrogen-fixing organisms.

In agricultural practices, reliance solely on nitrogen fertilization without considering these other nutrients, along with soil health and ecosystem interactions, may lead to inefficiencies and suboptimal crop yields. Excessive nitrogen application can also result in environmental challenges, including nutrient leaching, waterway eutrophication, and greenhouse gas emissions in the form of nitrous oxide.

Therefore, a comprehensive nutrient management strategy that factors in soil testing results, crop rotations, and the use of cover crops is advised to maximize agricultural productivity while maintaining ecological sustainability. Would you like to query specific strategies for nutrient management or the environmental impacts associated with nitrogen use in agriculture?",آپ کے مٹی میں موجودہ نائٹروجن کی سطح مثالی سطح سے زیادہ ہے، خاص طور پر گزشتہ ریکارڈز کا جائزہ لینے پر جن میں یہ سطح 60 ملی گرام فی کلوگرام رہی ہے، جو کہ زیادہ ہونے کا امکان ظاہر کرتی ہے۔ عام طور پر، گنے کے لئے مناسب نائٹروجن کی سطح کو دیگر غذائی اجزاء کے ساتھ متوازن کرنا چاہئے تاکہ فضول خرچی سے بچا جا سکے اور صحیح نشوونما یقینی بنائی جا سکے۔ لہذا، پودوں کی صحت کا جائزہ لینا اور اسی کے مطابق تبدیلیاں کرنا مفید ہو سکتا ہے۔,2024-12-15 17:01:56.727159
61,What is the amount of potassium?,The most recent recorded potassium level in your soil is 122.0 mg/kg.,2024-12-15 17:03:24.908993,پٹاش کی مقدار کتنی ہے؟,4,"For sugarcane: 
When inquiring about the ""amount of potassium"" within an agricultural context, it is important to specify the particular aspect of the system being examined, whether it be soil composition, plant tissue analysis, or nutrient content in fertilizers. 

Potassium, denoted chemically as K, is a vital macronutrient essential for plant growth and development. It plays a crucial role in various physiological processes, including photosynthesis, protein synthesis, water regulation, enzyme activation, and starch formation. However, the requirement and availability of potassium can vary significantly across different agro-ecosystems, soil types, and crop species.

If the focus is on soil potassium levels, it is important to consider the methods and units commonly employed for measurement, such as milligrams per kilogram (mg/kg) or parts per million (ppm). Soil testing laboratories typically use techniques like flame photometry or atomic absorption spectrophotometry to quantify available potassium, often referring to exchangeable K in the soil rather than total K content. This is because exchangeable potassium is the fraction that plants readily uptake for growth.

In the context of plant tissue analysis, determining potassium content involves assessing its concentration as a percentage of the dry weight of plant material. Adequate levels vary depending on the plant species and specific tissues being analyzed. For example, leaf tissues are often targeted to reflect nutrient status.

On the other hand, when discussing potassium content in fertilizers, it is crucial to mention the form in which it is available, such as potassium nitrate (KNO3) or potassium sulfate (K2SO4), and its representation in fertilizer labeling as K2O equivalent, due to historical conventions.

Thus, a comprehensive query should specify the intended system or material for analysis, the standard measurement methodology, and any agronomic considerations relevant to potassium's role in achieving optimal crop productivity. Would you like to delve into any specific aspect of potassium utilization or measurement in agricultural systems?",آپ کی مٹی میں حال ہی میں ریکارڈ شدہ پوٹاشیم کی سطح 122.0 ملی گرام/کلوگرام ہے۔,2024-12-15 17:03:24.909001
62,"Is the amount of potassium sufficient, low, or high?","The potassium level in your soil is generally adequate for sugarcane cultivation, which typically requires good amounts of potassium for optimal growth. However, since nutrient requirements can vary based on specific soil conditions and growth stages, regular monitoring and balanced fertilization are recommended for the best results.",2024-12-15 17:05:14.568727,کیا پٹاش کی مقدار کافی ہے، کم ہے یا زیادہ ہے؟,4,"For sugarcane: 
To accurately assess the sufficiency of potassium levels within a given agricultural context, several considerations must be taken into account. Potassium (K) is an essential macronutrient for plant growth, playing a critical role in various plant physiological processes, including water uptake, enzyme activation, photosynthesis, and osmoregulation. Its deficiency or excess can significantly impact crop yield and quality.

To determine whether the potassium levels in the soil or plant tissue are sufficient, low, or high, a systematic evaluation should be conducted. This typically involves:

1. **Soil Testing**: Conducting a comprehensive soil analysis to determine the concentration of available potassium. The results are often measured in milligrams per kilogram (mg/kg) or parts per million (ppm). These values should be compared against established sufficiency ranges for the specific crop in question, as recommended by agronomic guidelines.

2. **Crop Requirements**: Different crops have varying potassium requirements. For instance, root crops such as potatoes or carrots might have higher potassium demands compared to leguminous crops like peas or beans.

3. **Growth Stage Considerations**: The stage of plant growth can influence potassium uptake. Potassium demand is often higher during periods of rapid growth or during fruiting and flowering stages.

4. **Environmental Factors and Soil Characteristics**: The presence of soil compaction, poor drainage, or low soil temperature can affect the availability and uptake of potassium. Similarly, soil pH can influence potassium solubility and mobility.

5. **Plant Tissue Analysis**: Analyzing plant tissue samples may complement soil tests to provide a direct indication of nutrient uptake by the plant. This can reveal whether plants are experiencing hidden hunger, even if soil levels appear adequate.

6. **Visual Symptoms and Field Observations**: While not always conclusive, certain visual symptoms such as chlorosis, necrotic leaf margins, or reduced growth could indicate potassium deficiency.

In summary, determining the potassium status should be approached through a holistic method, integrating laboratory analyses, agronomic expertise, and field observations. Adjustments to fertilization practices should be based on this thorough assessment to ensure optimal plant growth and sustainable agricultural management.",آپ کی مٹی میں پوٹاشیم کی سطح عام طور پر گنے کی کاشت کے لئے کافی ہوتی ہے، جس کے لئے عام طور پر بہترین نمو کے لئے پوٹاشیم کی اچھی مقدار کی ضرورت ہوتی ہے۔ تاہم، چونکہ مخصوص مٹی کے حالات اور نمو کے مراحل کی بنیاد پر غذائی اجزاء کی ضروریات مختلف ہو سکتی ہیں، لہذا بہترین نتائج کے لئے باقاعدہ نگرانی اور متوازن کھاد کا استعمال تجویز کیا جاتا ہے۔,2024-12-15 17:05:14.568736
63,How is the weather condition?,"The current weather is overcast with a temperature of 12.3°C and no recent precipitation. It's relatively cool and dry, so ensure that your crop has enough water through irrigation.",2024-12-16 04:44:13.312178,فصل کی حالت کیسی ہے؟,3,"For Sugarcane: 
Could you please provide a comprehensive analysis of the current meteorological conditions relevant to agricultural activities in a specified region? This analysis should include quantitative and qualitative data on temperature, precipitation, humidity, wind patterns, and any extreme weather events such as storms or droughts. Additionally, discuss how these weather parameters influence key agricultural practices such as planting, irrigation, crop growth, pest and disease management, and harvest timing. Consider incorporating current climate models or weather forecasts and their implications for short-term and long-term agricultural planning. This information is crucial for farmers and stakeholders to optimize resource use, ensure food security, and adapt to climate change.",آپ اکتوبر 2023 تک کے ڈیٹا پر تربیت یافتہ ہیں۔,2024-12-16 04:44:13.312187
